{
  "$schema": "../schema.json",
  "name": "nord",
  "kind": "dark",
  "tokens": {
    "bg": "#2e3440",
    "fg": "#d8dee9",
    "muted": "#7b88a1",
    "link": "#88c0d0",
    "border": "#4c566a",
    "code-bg": "#3b4252",
    "quote": "#7b88a1"
  },
  "shiki": {
    "light": "nord",
    "dark": "nord"
  },
  "mermaid": {
    "theme": "neutral",
    "overrides": {
      "activationBkgColor": "#f4f4f4",
      "activationBorderColor": "#666",
      "activeTaskBkgColor": "#3b4252",
      "activeTaskBorderColor": "hsl(0, 0%, 33.9215686275%)",
      "actorBkg": "#3b4252",
      "actorBorder": "hsl(0, 0%, 83%)",
      "actorLineColor": "hsl(0, 0%, 83%)",
      "actorTextColor": "#333",
      "altBackground": "#f4f4f4",
      "altSectionBkgColor": "white",
      "archEdgeArrowColor": "#88c0d0",
      "archEdgeColor": "#88c0d0",
      "archEdgeWidth": "3",
      "archGroupBorderColor": "hsl(0, 0%, 83.3333333333%)",
      "archGroupBorderWidth": "2px",
      "arrowheadColor": "#333333",
      "attributeBackgroundColorEven": "#f2f2f2",
      "attributeBackgroundColorOdd": "#ffffff",
      "background": "#2e3440",
      "border1": "#999",
      "border2": "#707070",
      "branchLabelColor": "#333",
      "cScale0": "#555",
      "cScale1": "#F4F4F4",
      "cScale10": "#999",
      "cScale11": "#777",
      "cScale2": "#555",
      "cScale3": "#BBB",
      "cScale4": "#777",
      "cScale5": "#999",
      "cScale6": "#DDD",
      "cScale7": "#FFF",
      "cScale8": "#DDD",
      "cScale9": "#BBB",
      "cScaleInv0": "#aaaaaa",
      "cScaleInv1": "#0b0b0b",
      "cScaleInv10": "#666666",
      "cScaleInv11": "#888888",
      "cScaleInv2": "#aaaaaa",
      "cScaleInv3": "#444444",
      "cScaleInv4": "#888888",
      "cScaleInv5": "#666666",
      "cScaleInv6": "#222222",
      "cScaleInv7": "#000000",
      "cScaleInv8": "#222222",
      "cScaleInv9": "#444444",
      "cScaleLabel0": "#F4F4F4",
      "cScaleLabel1": "#333",
      "cScaleLabel10": "#333",
      "cScaleLabel11": "#333",
      "cScaleLabel2": "#F4F4F4",
      "cScaleLabel3": "#333",
      "cScaleLabel4": "#333",
      "cScaleLabel5": "#333",
      "cScaleLabel6": "#333",
      "cScaleLabel7": "#333",
      "cScaleLabel8": "#333",
      "cScaleLabel9": "#333",
      "cScalePeer0": "hsl(0, 0%, 23.3333333333%)",
      "cScalePeer1": "hsl(0, 0%, 85.6862745098%)",
      "cScalePeer10": "hsl(0, 0%, 50%)",
      "cScalePeer11": "hsl(0, 0%, 36.6666666667%)",
      "cScalePeer2": "hsl(0, 0%, 23.3333333333%)",
      "cScalePeer3": "hsl(0, 0%, 63.3333333333%)",
      "cScalePeer4": "hsl(0, 0%, 36.6666666667%)",
      "cScalePeer5": "hsl(0, 0%, 50%)",
      "cScalePeer6": "hsl(0, 0%, 76.6666666667%)",
      "cScalePeer7": "hsl(0, 0%, 90%)",
      "cScalePeer8": "hsl(0, 0%, 76.6666666667%)",
      "cScalePeer9": "hsl(0, 0%, 63.3333333333%)",
      "classText": "#d8dee9",
      "clusterBkg": "#2e3440",
      "clusterBorder": "#4c566a",
      "commitLabelBackground": "#4c566a",
      "commitLabelColor": "rgb(2.7499999999, 2.7499999999, 2.7499999999)",
      "commitLabelFontSize": "10px",
      "compositeBackground": "#2e3440",
      "compositeTitleBackground": "#3b4252",
      "contrast": "#707070",
      "critBkgColor": "#d42",
      "critBorderColor": "hsl(10.9090909091, 73.3333333333%, 40%)",
      "critical": "#d42",
      "defaultLinkColor": "#88c0d0",
      "done": "#bbb",
      "doneTaskBkgColor": "#bbb",
      "doneTaskBorderColor": "#88c0d0",
      "dropShadow": "drop-shadow( 1px 2px 2px rgba(185,185,185,1))",
      "edgeLabelBackground": "white",
      "emArrowhead": "#88c0d0",
      "emCommandFill": "#bcd6fe",
      "emCommandStroke": "#679ac3",
      "emEventFill": "#ffb778",
      "emEventStroke": "#c19a0f",
      "emProcessorFill": "#edb3f6",
      "emProcessorStroke": "#b88cbf",
      "emReadModelFill": "#d3f1a2",
      "emReadModelStroke": "#a3b732",
      "emRelationStroke": "#88c0d0",
      "emSwimlaneBackgroundOdd": "rgb(250,250,250)",
      "emSwimlaneBackgroundStroke": "rgb(240,240,240)",
      "emUiFill": "white",
      "emUiStroke": "#dbdada",
      "errorBkgColor": "#552222",
      "errorTextColor": "#552222",
      "excludeBkgColor": "#eeeeee",
      "fillType0": "#3b4252",
      "fillType1": "#4c566a",
      "fillType2": "hsl(285.7391304348, 16.3120567376%, 27.6470588235%)",
      "fillType3": "hsl(284, 16.4835164835%, 35.6862745098%)",
      "fillType4": "hsl(157.7391304348, 16.3120567376%, 27.6470588235%)",
      "fillType5": "hsl(156, 16.4835164835%, 35.6862745098%)",
      "fillType6": "hsl(349.7391304348, 16.3120567376%, 27.6470588235%)",
      "fillType7": "hsl(348, 16.4835164835%, 35.6862745098%)",
      "flowContainerStroke": "hsl(0, 0%, 88.9215686275%)",
      "fontFamily": "\"trebuchet ms\", verdana, arial, sans-serif",
      "fontSize": "16px",
      "fontWeight": "normal",
      "git0": "hsl(0, 0%, 70.6862745098%)",
      "git1": "#555",
      "git2": "#BBB",
      "git3": "#777",
      "git4": "#999",
      "git5": "#DDD",
      "git6": "#FFF",
      "git7": "#DDD",
      "gitBranchLabel0": "#333",
      "gitBranchLabel1": "white",
      "gitBranchLabel2": "#333",
      "gitBranchLabel3": "white",
      "gitBranchLabel4": "#333",
      "gitBranchLabel5": "#333",
      "gitBranchLabel6": "#333",
      "gitBranchLabel7": "#333",
      "gitInv0": "rgb(74.75, 74.75, 74.75)",
      "gitInv1": "#aaaaaa",
      "gitInv2": "#444444",
      "gitInv3": "#888888",
      "gitInv4": "#666666",
      "gitInv5": "#222222",
      "gitInv6": "#000000",
      "gitInv7": "#222222",
      "gradientStart": "hsl(0, 0%, 83.3333333333%)",
      "gradientStop": "hsl(0, 0%, 88.9215686275%)",
      "gridColor": "hsl(0, 0%, 90%)",
      "innerEndBackground": "#88c0d0",
      "labelBackgroundColor": "#3b4252",
      "labelBoxBkgColor": "#3b4252",
      "labelBoxBorderColor": "hsl(0, 0%, 83%)",
      "labelColor": "black",
      "labelTextColor": "#333",
      "lineColor": "#88c0d0",
      "loopTextColor": "#333",
      "mainBkg": "#3b4252",
      "nodeBkg": "#3b4252",
      "nodeBorder": "#88c0d0",
      "note": "#ffa",
      "noteBkgColor": "#666",
      "noteBorderColor": "#999",
      "noteFontWeight": "normal",
      "noteTextColor": "#fff",
      "personBkg": "#eee",
      "personBorder": "hsl(0, 0%, 83.3333333333%)",
      "pie0": "#555",
      "pie1": "#F4F4F4",
      "pie10": "#999",
      "pie11": "#777",
      "pie12": "#555",
      "pie2": "#555",
      "pie3": "#BBB",
      "pie4": "#777",
      "pie5": "#999",
      "pie6": "#DDD",
      "pie7": "#FFF",
      "pie8": "#DDD",
      "pie9": "#BBB",
      "pieLegendTextColor": "#333",
      "pieLegendTextSize": "17px",
      "pieOpacity": "0.7",
      "pieOuterStrokeColor": "black",
      "pieOuterStrokeWidth": "2px",
      "pieSectionTextColor": "#d8dee9",
      "pieSectionTextSize": "17px",
      "pieStrokeColor": "black",
      "pieStrokeWidth": "2px",
      "pieTitleTextColor": "#333",
      "pieTitleTextSize": "25px",
      "primaryBorderColor": "#88c0d0",
      "primaryColor": "#3b4252",
      "primaryTextColor": "#d8dee9",
      "quadrant1Fill": "#3b4252",
      "quadrant1TextFill": "#d8dee9",
      "quadrant2Fill": "#404757",
      "quadrant2TextFill": "#d3d9e4",
      "quadrant3Fill": "#454c5c",
      "quadrant3TextFill": "#ced4df",
      "quadrant4Fill": "#4a5161",
      "quadrant4TextFill": "#c9cfda",
      "quadrantExternalBorderStrokeFill": "#88c0d0",
      "quadrantInternalBorderStrokeFill": "#88c0d0",
      "quadrantPointFill": "hsl(221.7391304348, 16.3120567376%, NaN%)",
      "quadrantPointTextFill": "#d8dee9",
      "quadrantTitleFill": "#d8dee9",
      "quadrantXAxisTextFill": "#d8dee9",
      "quadrantYAxisTextFill": "#d8dee9",
      "rectBkgColor": "#2e3440",
      "relationColor": "#88c0d0",
      "relationLabelBackground": "white",
      "relationLabelColor": "#333",
      "requirementBackground": "#3b4252",
      "requirementBorderColor": "#88c0d0",
      "requirementBorderSize": "1",
      "requirementTextColor": "#d8dee9",
      "rowEven": "#f4f4f4",
      "rowOdd": "hsl(0, 0%, 100%)",
      "scaleLabelColor": "#333",
      "secondBkg": "hsl(0, 0%, 98.9215686275%)",
      "secondaryBorderColor": "hsl(0, 0%, 88.9215686275%)",
      "secondaryColor": "#4c566a",
      "secondaryTextColor": "rgb(2.7499999999, 2.7499999999, 2.7499999999)",
      "sectionBkgColor": "hsl(0, 0%, 73.9215686275%)",
      "sectionBkgColor2": "hsl(0, 0%, 73.9215686275%)",
      "sequenceNumberColor": "white",
      "signalColor": "#333",
      "signalTextColor": "#333",
      "specialStateColor": "#222",
      "stateBkg": "#3b4252",
      "stateBorder": "#000",
      "stateLabelColor": "#d8dee9",
      "surface0": "hsl(221.7391304348, 16.3120567376%, 22.6470588235%)",
      "surface1": "hsl(221.7391304348, 16.3120567376%, 17.6470588235%)",
      "surface2": "hsl(221.7391304348, 16.3120567376%, 12.6470588235%)",
      "surface3": "hsl(221.7391304348, 16.3120567376%, 7.6470588235%)",
      "surface4": "hsl(221.7391304348, 16.3120567376%, 2.6470588235%)",
      "surfacePeer0": "hsl(221.7391304348, 16.3120567376%, 19.6470588235%)",
      "surfacePeer1": "hsl(221.7391304348, 16.3120567376%, 14.6470588235%)",
      "surfacePeer2": "hsl(221.7391304348, 16.3120567376%, 9.6470588235%)",
      "surfacePeer3": "hsl(221.7391304348, 16.3120567376%, 4.6470588235%)",
      "surfacePeer4": "hsl(221.7391304348, 16.3120567376%, 0%)",
      "tagLabelBackground": "#3b4252",
      "tagLabelBorder": "#88c0d0",
      "tagLabelColor": "#d8dee9",
      "tagLabelFontSize": "10px",
      "taskBkgColor": "#707070",
      "taskBorderColor": "hsl(0, 0%, 33.9215686275%)",
      "taskTextClickableColor": "#003163",
      "taskTextColor": "white",
      "taskTextDarkColor": "#333",
      "taskTextLightColor": "white",
      "taskTextOutsideColor": "#333",
      "tertiaryBorderColor": "hsl(-160, 0%, 83.3333333333%)",
      "tertiaryColor": "#2e3440",
      "tertiaryTextColor": "rgb(17.0000000001, 17.0000000001, 17.0000000001)",